{
  "start": "bienvenida",
  "manual_categories": [
    {
      "id": "vehiculo_robado",
      "name": "Vehículo Robado",
      "keys": [
        "robo",
        "auto",
        "vehiculo",
        "patente",
        "estacionado",
        "bmw",
        "x1",
        "placa"
      ],
      "when": "Cuando reportan la desaparición de un vehículo",
      "steps": [
        "Mantén la calma del usuario",
        "Solicita ubicación exacta del vehículo",
        "Recopila detalles: patente, marca, modelo, color",
        "Busca la dirección en el mapa si es necesario",
        "Despacha Carabineros y considera Seguridad Ciudadana"
      ],
      "avoid": [
        "No intentes ser empático si el usuario está alterado",
        "No saltes pasos del protocolo",
        "No dejes al usuario sin asistencia en terreno"
      ],
      "dispatch": "Carabineros + Seguridad Ciudadana"
    },
    {
      "id": "persona_riesgo",
      "name": "Persona en Riesgo",
      "keys": [
        "peligro",
        "amenaza",
        "agresion",
        "miedo",
        "auxilio",
        "ayuda"
      ],
      "when": "Cuando alguien reporta amenaza directa a su seguridad",
      "steps": [
        "Obtén descripción de la amenaza",
        "Confirma ubicación actual",
        "Pregunta si el agresor está presente",
        "Despacha unidades de inmediato",
        "Mantén la línea abierta hasta la llegada"
      ],
      "avoid": [
        "No preguntes detalles innecesarios que demoren despacho",
        "No cuelgues la línea",
        "No juzgues la gravedad percibida"
      ],
      "dispatch": "Carabineros + Ambulancia si hay lesiones"
    },
    {
      "id": "accidente_transito",
      "name": "Accidente de Tránsito",
      "keys": [
        "choque",
        "colision",
        "atropello",
        "vehiculo",
        "ruta",
        "accidente"
      ],
      "when": "Cuando reportan colisión o choque vehicular",
      "steps": [
        "Pregunta si hay personas lesionadas",
        "Obtén ubicación exacta del accidente",
        "Solicita información de los vehículos involucrados",
        "Verifica si hay tráfico obstruido",
        "Despacha Carabineros y Ambulancia si hay heridos"
      ],
      "avoid": [
        "No des consejos sobre responsabilidad civil",
        "No permitas que el usuario se aleje del lugar",
        "No minimices posibles lesiones"
      ],
      "dispatch": "Carabineros + Ambulancia"
    },
    {
      "id": "incendio_humo",
      "name": "Incendio o Humo",
      "keys": [
        "humo",
        "fuego",
        "olor a quemado",
        "llamas",
        "explosion",
        "incendio"
      ],
      "when": "Cuando reportan fuego o humo sospechoso",
      "steps": [
        "Pide que describa el incendio o humo",
        "Confirma ubicación y número de pisos",
        "Pregunta si hay personas atrapadas",
        "Ordena evacuación si es necesario",
        "Despacha Bomberos de inmediato"
      ],
      "avoid": [
        "No aconsejes intentar apagar el fuego",
        "No dejes que esperen dentro del lugar",
        "No subestimes humos de origen desconocido"
      ],
      "dispatch": "Bomberos + Carabineros"
    },
    {
      "id": "salud_urgente",
      "name": "Salud Urgente",
      "keys": [
        "desmayo",
        "dolor pecho",
        "convulsion",
        "respira",
        "inconsciente",
        "paro"
      ],
      "when": "Cuando reportan emergencia médica o pérdida de conciencia",
      "steps": [
        "Determina el síntoma principal",
        "Pregunta si está consciente",
        "Solicita ubicación exacta",
        "Proporciona instrucciones RCP si es necesario",
        "Despacha Ambulancia prioritaria"
      ],
      "avoid": [
        "No des diagnósticos",
        "No hagas esperar si es paro cardíaco",
        "No termines la llamada antes de que llegue ambulancia"
      ],
      "dispatch": "Ambulancia (PRIORIDAD)"
    },
    {
      "id": "violencia_intrafamiliar",
      "name": "Violencia Intrafamiliar",
      "keys": [
        "golpes",
        "pareja",
        "amenaza",
        "gritos",
        "encerrada",
        "violencia",
        "abuso"
      ],
      "when": "Cuando reportan violencia en el contexto familiar o de pareja",
      "steps": [
        "Verifica si hay peligro inmediato",
        "Pregunta si el agresor está presente",
        "Obtén descripción del agresor",
        "Confirma ubicación segura",
        "Despacha Carabineros y considera apoyo psicosocial"
      ],
      "avoid": [
        "No juzgues por qué no se fueron antes",
        "No minimices patrones de abuso",
        "No des la línea al agresor"
      ],
      "dispatch": "Carabineros + Unidad especializada"
    },
    {
      "id": "persona_extraviada",
      "name": "Persona Extraviada",
      "keys": [
        "desaparecida",
        "extraviado",
        "no llega",
        "ultimo contacto",
        "busqueda"
      ],
      "when": "Cuando reportan que alguien desapareció o no llegó a su destino",
      "steps": [
        "Obtén descripción física de la persona",
        "Pregunta cuándo fue visto por última vez",
        "Solicita último lugar confirmado",
        "Recopila información de ropa y accesorios",
        "Coordina búsqueda con Carabineros"
      ],
      "avoid": [
        "No esperes 24 horas si hay riesgo",
        "No subestimes desapariciones en menores",
        "No minimices si está en zona peligrosa"
      ],
      "dispatch": "Carabineros + Equipos de búsqueda"
    }
  ],
  "scenes": [
    {
      "id": "bienvenida",
      "title": "Haz click en Continuar",
      "objective": "Bienvenida y clavesecreta",
      "beats": [
        {
          "kind": "input",
          "field": "clavesecreta",
          "setValue": "clavesecreta",
          "answer": "clavesecreta",
          "hint": "Ingresa la clave secreta para continuar.",
          "errorMsg": "No es correcto."
        },
        {
          "kind": "vignette",
          "action": "open",
          "scene": "negro",
          "text": "Cae la lluvia, luego pasos y una respiración acelerada."
        },
        {
          "kind": "sfx",
          "sfx": "running"
        },
        {
          "kind": "vignette",
          "action": "open",
          "scene": "eric_corre_1",
          "text": "Un joven de unos veinte años corre por la calle esquivando peatones. El es ERIC."
        },
        {
          "kind": "ambient",
          "ambient": "city"
        },
        {
          "speaker": "ERIC",
          "text": "Permiso. Perdón. Permiso."
        },
        {
          "kind": "sfx",
          "action": "stop"
        },
        {
          "kind": "vignette",
          "action": "open",
          "scene": "eric_morral",
          "text": "Eric tiene un morral colgándole del hombro. En un momento se le engancha con un poste, se le raja y se le caen algunas cosas."
        },
        {
          "kind": "vignette",
          "action": "open",
          "scene": "eric_recoge_morral",
          "text": "Las recoje mientras mira los edificios."
        },
        {
          "kind": "vignette",
          "action": "open",
          "scene": "eric_llega_una_luz_prendida",
          "text": "Mirando su teléfono se detiene frente a un edificio casi apagado. Solo una luz está encendida. Corre."
        }
      ],
      "next": "intro",
      "channel": "narration"
    },
    {
      "id": "call_fragment",
      "title": "Fragmento de Llamada",
      "objective": "Primeros intentos de comunicación. Eric debe decidir si buscar ayuda en el manual o improvisar.",
      "beats": [
        {
          "speaker": "ERIC",
          "text": "Eh... ¿Aló?"
        },
        {
          "speaker": "MENSAJE",
          "text": "Aló, necesito--"
        },
        {
          "kind": "narration",
          "text": "De pronto, el mensaje se corta."
        },
        {
          "kind": "narration",
          "text": "Eric mira la pantalla desesperado tratando de encontrar el mensaje. Nada."
        },
        {
          "speaker": "ERIC",
          "text": "¿Aló, aló, aló? ¿Señorita...?"
        },
        {
          "kind": "narration",
          "text": "De pronto, otro mensaje aparece en la pantalla. Ahora sí, Eric responde enseguida..."
        },
        {
          "speaker": "MENSAJE",
          "text": "¡Aló, por favor, necesito ayuda!"
        },
        {
          "kind": "narration",
          "text": "Eric, con la urgencia, no lo nota, pero esta, aunque es una voz femenina, evidentemente no es la misma voz de antes."
        },
        {
          "speaker": "ERIC",
          "text": "Eh..."
        }
      ],
      "choices": [
        {
          "at": 8,
          "prompt": "¿Qué vas a hacer? ¿Buscar ayuda en el manual o improvisar?",
          "options": [
            {
              "label": "Buscar ayuda en el manual",
              "goto": "manual_search",
              "beats": []
            }
          ]
        }
      ],
      "channel": "911"
    },
    {
      "id": "dani_chat",
      "title": "Mensaje de Dani",
      "objective": "Eric contacta a su amiga/novia Dani. Ella lo orienta sobre el manual.",
      "beats": [
        {
          "kind": "narration",
          "text": "Eric mira la pantalla del computador. Fijo. No pasa nada. No entra ningún mensaje. No sabe qué hacer. [TEST STORY MAP E2E]"
        },
        {
          "kind": "vignette",
          "action": "open",
          "scene": "mensaje_dani",
          "text": "Eric toma su teléfono y busca un contacto: DANI. Abre el chat y escribe: 'Llegué'."
        },
        {
          "kind": "wa",
          "contact": "dani",
          "speaker": "ERIC",
          "text": "Llegué"
        },
        {
          "kind": "narration",
          "text": "Espera. De pronto... escribiendo..."
        },
        {
          "speaker": "DANI",
          "text": "¿Recién?"
        }
      ],
      "choices": [
        {